{
  "id": "baseline-v1",
  "label": "Baseline (stub runner)",
  "version": "1.0",
  "capabilities": {
    "produces_triage_report": true,
    "produces_escalation_packet": true,
    "max_clarifying_questions": 3,
    "allowed_evidence_patterns": [
      "TICKET-\\d+",
      "INC-\\d+",
      "https://logs\\.internal/",
      "https://metrics\\.internal/"
    ]
  },
  "runner": {
    "type": "stub",
    "model": "stub",
    "extra": {}
  }
}
